{
  "dump_id": "9b1f-demo",
  "schema": "macs.dump.v0",
  "source_telemetry_schema": "hermes.observer.v1",
  "captured_at": "2026-06-17T09:12:33+00:00",
  "trigger": {
    "predicate": "tool_repeat_fail",
    "detail": "tool=web_fetch",
    "matched_value": 3,
    "threshold": 3
  },
  "correlation": {
    "session_id": "sess-7f3a",
    "turn_id": "task-12",
    "api_request_id": "1",
    "parent_session_id": null,
    "subagent_id": null
  },
  "context": {
    "model": "claude-opus",
    "provider": "anthropic",
    "system_prompt": null,
    "input_messages": [
      {
        "role": "user",
        "content": "抓取并汇总这份季度报告"
      }
    ],
    "approx_input_tokens": 1840
  },
  "llm_response": {
    "assistant_message": {
      "role": "assistant",
      "content": "连续超时，无法获取报告"
    },
    "finish_reason": "stop",
    "usage": {
      "input_tokens": 1840,
      "output_tokens": 95
    },
    "reasoning": null
  },
  "tool_calls": [
    {
      "tool_call_id": "t0",
      "tool_name": "web_fetch",
      "args": {
        "url": "https://example.com/q3.pdf"
      },
      "status": "error",
      "duration_ms": null,
      "result": {
        "error": "read timeout after 30s"
      },
      "error_type": null,
      "error_message": "read timeout after 30s"
    },
    {
      "tool_call_id": "t1",
      "tool_name": "web_fetch",
      "args": {
        "url": "https://example.com/q3.pdf"
      },
      "status": "error",
      "duration_ms": null,
      "result": {
        "error": "read timeout after 30s"
      },
      "error_type": null,
      "error_message": "read timeout after 30s"
    },
    {
      "tool_call_id": "t2",
      "tool_name": "web_fetch",
      "args": {
        "url": "https://example.com/q3.pdf"
      },
      "status": "error",
      "duration_ms": null,
      "result": {
        "error": "read timeout after 30s"
      },
      "error_type": null,
      "error_message": "read timeout after 30s"
    }
  ],
  "subagents": [],
  "control_block": {
    "started_at": null,
    "api_call_count": 1,
    "tool_call_count": 3,
    "retry_count": 0,
    "duration_ms": 2100,
    "tokens": {
      "input_tokens": 1840,
      "output_tokens": 95
    },
    "estimated_cost_usd": null
  },
  "env": {
    "hermes_version": null,
    "platform": "telegram",
    "cwd": null
  }
}